course_name,platform,language,url
Apache Spark Deep Learning Essential Training,LinkedIn Learning,English,https://www.classcentral.com/course/linkedin-learning-apache-spark-deep-learning-essential-training-75104
SAS® 9.4 Cert Prep: Part 06 Exporting Results,LinkedIn Learning,English,https://www.classcentral.com/course/linkedin-learning-sas-9-4-cert-prep-part-06-exporting-results-78943
Introduction to Spark SQL and DataFrames,LinkedIn Learning,English,https://www.classcentral.com/course/linkedin-learning-introduction-to-spark-sql-and-dataframes-77073
Learning Data Visualization,LinkedIn Learning,English,https://www.classcentral.com/course/linkedin-learning-learning-data-visualization-44630
Qlik Sense Essential Training,LinkedIn Learning,English,https://www.classcentral.com/course/linkedin-learning-qlik-sense-essential-training-78689
Learning Data Visualization,LinkedIn Learning,English,https://www.classcentral.com/course/linkedin-learning-learning-data-visualization-44607
R for Data Science: Lunchbreak Lessons,LinkedIn Learning,English,https://www.classcentral.com/course/linkedin-learning-r-for-data-science-lunchbreak-lessons-78710
R Programming in Data Science: High Variety Data,LinkedIn Learning,English,https://www.classcentral.com/course/linkedin-learning-r-programming-in-data-science-high-variety-data-78712
R Programming in Data Science: High Velocity Data,LinkedIn Learning,English,https://www.classcentral.com/course/linkedin-learning-r-programming-in-data-science-high-velocity-data-78713
Architecting Big Data Applications: Real-Time Application Engineering,LinkedIn Learning,English,https://www.classcentral.com/course/linkedin-learning-architecting-big-data-applications-real-time-application-engineering-75134
"The Data Science of Government and Political Science, with Barton Poulson",LinkedIn Learning,English,https://www.classcentral.com/course/linkedin-learning-the-data-science-of-government-and-political-science-with-barton-poulson-79291
Meta-analysis for Data Science and Business Analytics,LinkedIn Learning,English,https://www.classcentral.com/course/linkedin-learning-meta-analysis-for-data-science-and-business-analytics-78085
Elasticsearch Essential Training,LinkedIn Learning,English,https://www.classcentral.com/course/linkedin-learning-elasticsearch-essential-training-76439
"The Data Science of Educational Management and Policy, with Barton Poulson",LinkedIn Learning,English,https://www.classcentral.com/course/linkedin-learning-the-data-science-of-educational-management-and-policy-with-barton-poulson-79288
The Data Science of Media and Entertainment with Barton Poulson,LinkedIn Learning,English,https://www.classcentral.com/course/linkedin-learning-the-data-science-of-media-and-entertainment-with-barton-poulson-79293
Architecting Big Data Applications: Batch Mode Application Engineering,LinkedIn Learning,English,https://www.classcentral.com/course/linkedin-learning-architecting-big-data-applications-batch-mode-application-engineering-75133
Scala Essential Training for Data Science,LinkedIn Learning,English,https://www.classcentral.com/course/linkedin-learning-scala-essential-training-for-data-science-78951
Apache Spark Essential Training,LinkedIn Learning,English,https://www.classcentral.com/course/linkedin-learning-apache-spark-essential-training-75105
Social Network Analysis Using R,LinkedIn Learning,English,https://www.classcentral.com/course/linkedin-learning-social-network-analysis-using-r-79098
Data Science Foundations: Data Mining,LinkedIn Learning,English,https://www.classcentral.com/course/linkedin-learning-data-science-foundations-data-mining-76128
SQL Tips and Tricks for Data Science,LinkedIn Learning,English,https://www.classcentral.com/course/linkedin-learning-sql-tips-and-tricks-for-data-science-79171
Apache PySpark by Example,LinkedIn Learning,English,https://www.classcentral.com/course/linkedin-learning-apache-pyspark-by-example-75103
Java for Data Scientists Essential Training,LinkedIn Learning,English,https://www.classcentral.com/course/linkedin-learning-java-for-data-scientists-essential-training-77163
Applied Data Analysis,FutureLearn,English,https://www.classcentral.com/course/applied-data-analysis-82239
Creating Flowcharts for Beginners,LinkedIn Learning,English,https://www.classcentral.com/course/linkedin-learning-creating-flowcharts-for-beginners-76000
Data Analytics for Decision Making,FutureLearn,English,https://www.classcentral.com/course/data-analytics-for-decision-making-21710
Advanced Data Analysis and Visualization Using Microsoft Excel,FutureLearn,English,https://www.classcentral.com/course/advanced-data-analysis-and-visualization-using-mi-80437
Successful Data Analysis for Modern Industries,FutureLearn,English,https://www.classcentral.com/course/applied-data-analysis-for-modern-organizations-80440
MBA in Business Analytics,Coursera,English,https://www.classcentral.com/course/op-jindal-global-mba-business-analytics-48054
Data Science Fundamentals on Microsoft Azure,FutureLearn,English,https://www.classcentral.com/course/data-science-fundamentals-microsoft-azure-48281
Hands-on Foundations for Data Science and Machine Learning Google Cloud Labs,Coursera,English,https://www.classcentral.com/course/hands-on-data-science-machine-learning-47265
"Python for Data Science Tips, Tricks, & Techniques",LinkedIn Learning,English,https://www.classcentral.com/course/linkedin-learning-python-for-data-science-tips-tricks-techniques-78667
"The Data Science of Economics, Banking, and Finance, with Barton Poulson",LinkedIn Learning,English,https://www.classcentral.com/course/linkedin-learning-the-data-science-of-economics-banking-and-finance-with-barton-poulson-79287
Data Science on Microsoft Azure using R Programming,FutureLearn,English,https://www.classcentral.com/course/introduction-data-science-microsoft-azure-using-r-48282
Fundamentos de Ciencia de Datos con Python y SQL,Coursera,English,https://www.classcentral.com/course/fundamentos-de-ciencia-de-datos-con-python-y-sql-34173
Data Visualisation,FutureLearn,English,https://www.classcentral.com/course/data-visualisation-48294
Key Technologies in Data Analytics,Coursera,English,https://www.classcentral.com/course/key-technologies-data-analytics-40226
Data Science on Microsoft Azure Using Python Programming,FutureLearn,English,https://www.classcentral.com/course/data-science-microsoft-azure-python-programming-48283
Applied Data Science with R,Coursera,English,https://www.classcentral.com/course/applied-data-science-r-40340
Data Science and Engineering with Spark,edX,English,https://www.classcentral.com/course/data-science-engineering-apache-spark-18485
Introduction to Computational Statistics for Data Scientists,Coursera,English,https://www.classcentral.com/course/compstats-40719
Foundations of Data Science,edX,English,https://www.classcentral.com/course/berkeleyx-foundations-of-data-science-18422
CertNexus Certified Ethical Emerging Technologist,Coursera,English,https://www.classcentral.com/course/certified-ethical-emerging-technologist-22613
Analista de Datos de IBM,Coursera,English,https://www.classcentral.com/course/certificado-profesional-analista-de-datos-de-ibm-27237
Data Analytics for Business,FutureLearn,English,https://www.classcentral.com/course/data-analytics-for-business-48293
AI Design and Engineering with Microsoft Azure,FutureLearn,English,https://www.classcentral.com/course/ai-engineer-with-microsoft-azure-48310
Data Analytics Using Python,FutureLearn,English,https://www.classcentral.com/course/data-analytics-using-python-48295
Data Analysis with Excel for Complete Beginners,FutureLearn,English,https://www.classcentral.com/course/data-analysis-fundamentals-with-excel-48280
Data Visualisation with Python,FutureLearn,English,https://www.classcentral.com/course/data-visualisation-with-python-48296
SAS® 9.4 Cert Prep: Part 14 Restructuring Tables,LinkedIn Learning,English,https://www.classcentral.com/course/linkedin-learning-sas-9-4-cert-prep-part-14-restructuring-tables-78947
IBM Data Engineering,Coursera,English,https://www.classcentral.com/course/ibm-data-engineer-48126
SAS® 9.4 Cert Prep: Part 08 Controlling Data Step Processing,LinkedIn Learning,English,https://www.classcentral.com/course/linkedin-learning-sas-9-4-cert-prep-part-08-controlling-data-step-processing-78940
Apache Flink: Batch Mode Data Engineering,LinkedIn Learning,English,https://www.classcentral.com/course/linkedin-learning-apache-flink-batch-mode-data-engineering-75100
SAS® 9.4 Cert Prep: Part 09 Summarizing Data,LinkedIn Learning,English,https://www.classcentral.com/course/linkedin-learning-sas-9-4-cert-prep-part-09-summarizing-data-78948
SAS® 9.4 Cert Prep: Part 13 Processing Repetitive Code,LinkedIn Learning,English,https://www.classcentral.com/course/linkedin-learning-sas-9-4-cert-prep-part-13-processing-repetitive-code-78946
SAS® 9.4 Cert Prep: Part 07 Using SQL in SAS,LinkedIn Learning,English,https://www.classcentral.com/course/linkedin-learning-sas-9-4-cert-prep-part-07-using-sql-in-sas-40079
"Advanced SAS Programming for R Users, Part 2",LinkedIn Learning,English,https://www.classcentral.com/course/linkedin-learning-advanced-sas-programming-for-r-users-part-2-39595
Cloud Hadoop: Scaling Apache Spark,LinkedIn Learning,English,https://www.classcentral.com/course/linkedin-learning-cloud-hadoop-scaling-apache-spark-29751
Practical Data Mining,FutureLearn,English,https://www.classcentral.com/course/data-mining-18266
IBM Data Analytics with Excel and R,Coursera,English,https://www.classcentral.com/course/ibm-data-analyst-r-excel-40717
Data Science Fundamentals with Python and SQL,Coursera,English,https://www.classcentral.com/course/data-science-fundamentals-python-sql-22282
Music Retrieval Systems,Kadenze,English,https://www.classcentral.com/course/kadenze-music-retrieval-systems-8399
Data Engineering Foundations,Coursera,English,https://www.classcentral.com/course/data-engineering-foundations-32180
Machine Learning for Music Information Retrieval,Kadenze,English,https://www.classcentral.com/course/kadenze-machine-learning-for-music-information-retrieval-20978
SAS® 9.4 Cert Prep: Part 10 Manipulating Data with Functions,LinkedIn Learning,English,https://www.classcentral.com/course/linkedin-learning-sas-9-4-cert-prep-part-10-manipulating-data-with-functions-78944
Data Science with Databricks for Data Analysts,Coursera,English,https://www.classcentral.com/course/data-science-with-databricks-for-data-analysts-22279
DC.js for Data Science Essential Training,LinkedIn Learning,English,https://www.classcentral.com/course/linkedin-learning-dc-js-for-data-science-essential-training-29906
"SAS Programming for R Users, Part 2",LinkedIn Learning,English,https://www.classcentral.com/course/linkedin-learning-sas-programming-for-r-users-part-2-40077
SAS Essential Training: 2 Regression Analysis for Healthcare Research,LinkedIn Learning,English,https://www.classcentral.com/course/linkedin-learning-sas-essential-training-2-regression-analysis-for-healthcare-research-31254
SAS® 9.4 Cert Prep: Part 03 Exploring and Validating Data,LinkedIn Learning,English,https://www.classcentral.com/course/linkedin-learning-sas-9-4-cert-prep-part-03-exploring-and-validating-data-78942
Learning Hadoop,LinkedIn Learning,English,https://www.classcentral.com/course/linkedin-learning-learning-hadoop-30476
Data Visualization: Best Practices,LinkedIn Learning,English,https://www.classcentral.com/course/linkedin-learning-data-visualization-best-practices-76133
15 Mistakes to Avoid in Data Science,LinkedIn Learning,English,https://www.classcentral.com/course/linkedin-learning-15-mistakes-to-avoid-in-data-science-74777
"Advanced SAS Programming for R Users, Part 1",LinkedIn Learning,English,https://www.classcentral.com/course/linkedin-learning-advanced-sas-programming-for-r-users-part-1-39594
SAS® 9.4 Cert Prep: Part 01 SAS Programming Essentials,LinkedIn Learning,English,https://www.classcentral.com/course/linkedin-learning-sas-9-4-cert-prep-part-01-sas-programming-essentials-40078
Learning the Elastic Stack,LinkedIn Learning,English,https://www.classcentral.com/course/linkedin-learning-learning-the-elastic-stack-77692
" More Python Tips, Tricks, and Techniques for Data Science",LinkedIn Learning,English,https://www.classcentral.com/course/linkedin-learning-more-python-tips-tricks-and-techniques-for-data-science-78195
Data Analysis and Visualization Foundations,Coursera,English,https://www.classcentral.com/course/data-analysis-visualization-foundations-22283
Learning the Elastic Stack,LinkedIn Learning,English,https://www.classcentral.com/course/linkedin-learning-learning-the-elastic-stack-77691
SAS Essential Training: 1 Descriptive Analysis for Healthcare Research,LinkedIn Learning,English,https://www.classcentral.com/course/linkedin-learning-sas-essential-training-1-descriptive-analysis-for-healthcare-research-31253
The Data Science of Experimental Design,LinkedIn Learning,English,https://www.classcentral.com/course/linkedin-learning-the-data-science-of-experimental-design-79289
Data Visualization for Marketers,LinkedIn Learning,English,https://www.classcentral.com/course/linkedin-learning-data-visualization-for-marketers-29898
"Cleaning, Transforming and Prepping Your Data With Tableau Prep",LinkedIn Learning,English,https://www.classcentral.com/course/linkedin-learning-cleaning-transforming-and-prepping-your-data-with-tableau-prep-39692
Creating Interactive Tableau Dashboards,LinkedIn Learning,English,https://www.classcentral.com/course/linkedin-learning-creating-interactive-tableau-dashboards-39724
SAS® 9.4 Cert Prep: Part 02 Accessing Data,LinkedIn Learning,English,https://www.classcentral.com/course/linkedin-learning-sas-9-4-cert-prep-part-02-accessing-data-78937
"SAS Programming for R Users, Part 1",LinkedIn Learning,English,https://www.classcentral.com/course/linkedin-learning-sas-programming-for-r-users-part-1-40076
Tableau and R for Analytics Projects,LinkedIn Learning,English,https://www.classcentral.com/course/linkedin-learning-tableau-and-r-for-analytics-projects-40155
The Data Science of Gaming and Fantasy Sports,LinkedIn Learning,English,https://www.classcentral.com/course/linkedin-learning-the-data-science-of-gaming-and-fantasy-sports-79290
Creating Interactive Tableau Dashboards,LinkedIn Learning,English,https://www.classcentral.com/course/linkedin-learning-creating-interactive-tableau-dashboards-39723
D3.js Essential Training for Data Scientists,LinkedIn Learning,English,https://www.classcentral.com/course/linkedin-learning-d3-js-essential-training-for-data-scientists-29890
pandas Essential Training,LinkedIn Learning,English,https://www.classcentral.com/course/linkedin-learning-pandas-essential-training-30909
Modern Big Data Analysis with SQL,Coursera,English,https://www.classcentral.com/course/cloudera-big-data-analysis-sql-18809
Systems Biology and Biotechnology,Coursera,English,https://www.classcentral.com/course/systems-biology-18683
Ethics and Law in Data Analytics,LinkedIn Learning,English,https://www.classcentral.com/course/linkedin-learning-ethics-and-law-in-data-analytics-61003
Learning Data Visualization with D3.js,LinkedIn Learning,English,https://www.classcentral.com/course/linkedin-learning-learning-data-visualization-with-d3-js-30447
Tableau 10: Mastering Calculations,LinkedIn Learning,English,https://www.classcentral.com/course/linkedin-learning-tableau-10-mastering-calculations-31412
Insights on Data Science: Lillian Pierson,LinkedIn Learning,English,https://www.classcentral.com/course/linkedin-learning-insights-on-data-science-lillian-pierson-61027
IBM Data Analyst,Coursera,English,https://www.classcentral.com/course/ibm-data-analyst-21669
Integrating Tableau and R for Data Science,LinkedIn Learning,English,https://www.classcentral.com/course/linkedin-learning-integrating-tableau-and-r-for-data-science-39840
SAS Programmer,Coursera,English,https://www.classcentral.com/course/sas-programming-18663
Data Visualization: A Lesson and Listen Series,LinkedIn Learning,English,https://www.classcentral.com/course/linkedin-learning-data-visualization-a-lesson-and-listen-series-29900
R Programming in Data Science: High Volume Data,LinkedIn Learning,English,https://www.classcentral.com/course/linkedin-learning-r-programming-in-data-science-high-volume-data-78714
Advanced Data Science with IBM,Coursera,English,https://www.classcentral.com/course/advanced-data-science-ibm-18680
"Hadoop for Data Science Tips, Tricks, & Techniques",LinkedIn Learning,English,https://www.classcentral.com/course/linkedin-learning-hadoop-for-data-science-tips-tricks-techniques-76768
"Data Engineering, Big Data, and Machine Learning on GCP",Coursera,English,https://www.classcentral.com/course/gcp-data-machine-learning-18608
Information Visualization ,Coursera,English,https://www.classcentral.com/course/information-visualization-18898
Tableau Essential Training (2018),LinkedIn Learning,English,https://www.classcentral.com/course/linkedin-learning-tableau-essential-training-2018-40156
Applied Data Science,Coursera,English,https://www.classcentral.com/course/applied-data-science-18818
SPSS Statistics Essential Training,LinkedIn Learning,English,https://www.classcentral.com/course/linkedin-learning-spss-statistics-essential-training-79161
Python Data Analysis,LinkedIn Learning,English,https://www.classcentral.com/course/linkedin-learning-python-data-analysis-31116
Using Data Science to Hire Employees,LinkedIn Learning,English,https://www.classcentral.com/course/linkedin-learning-using-data-science-to-hire-employees-61153
IBM Applied AI,Coursera,English,https://www.classcentral.com/course/applied-artifical-intelligence-ibm-watson-ai-18740
The Data Science of Marketing,LinkedIn Learning,English,https://www.classcentral.com/course/linkedin-learning-the-data-science-of-marketing-61089
Tableau Essential Training (2020.1),LinkedIn Learning,English,https://www.classcentral.com/course/linkedin-learning-tableau-essential-training-2020-1-40157
Introduction to Data Science,Coursera,English,https://www.classcentral.com/course/introduction-data-science-18764
Bracketology Club: Using March Madness to Learn Data Science,LinkedIn Learning,English,https://www.classcentral.com/course/linkedin-learning-bracketology-club-using-march-madness-to-learn-data-science-61117
Learning Data Analytics: 1 Foundations,LinkedIn Learning,English,https://www.classcentral.com/course/linkedin-learning-learning-data-analytics-1-foundations-60916
Data Visualization: Storytelling,LinkedIn Learning,English,https://www.classcentral.com/course/linkedin-learning-data-visualization-storytelling-76135
Data Visualization for Data Analysis and Analytics,LinkedIn Learning,English,https://www.classcentral.com/course/linkedin-learning-data-visualization-for-data-analysis-and-analytics-60899
Learning Data Science: Tell Stories With Data,LinkedIn Learning,English,https://www.classcentral.com/course/linkedin-learning-learning-data-science-tell-stories-with-data-61045
Data Fluency: Exploring and Describing Data,LinkedIn Learning,English,https://www.classcentral.com/course/linkedin-learning-data-fluency-exploring-and-describing-data-60898
Tableau 10 for Data Scientists,LinkedIn Learning,English,https://www.classcentral.com/course/linkedin-learning-tableau-10-for-data-scientists-40154
Data Science: Data-Driven Decision Making,FutureLearn,English,https://www.classcentral.com/course/data-driven-decision-making-18277
Data Science: Data-Driven Decision Making,FutureLearn,English,https://www.classcentral.com/course/data-driven-decision-making-20632
Big Data,edX,English,https://www.classcentral.com/course/adelaidex-big-data-18320
Master Data Analysis with Pandas: Learning Path 1 (Enhanced),Coursera,English,https://www.classcentral.com/course/master-data-analysis-with-pandas-learning-path-1--86175
Data Science Foundations: Fundamentals (2019),LinkedIn Learning,English,https://www.classcentral.com/course/linkedin-learning-data-science-foundations-fundamentals-2019-77054
Google Data Analytics,Coursera,English,https://www.classcentral.com/course/google-data-analytics-36441
Fundamentals of Data Visualization with Power BI,edX,English,https://www.classcentral.com/course/fundamentals-of-data-visualization-with-power-bi-35065
How To Create A Sales Forecast In Tableau,Coursera,English,https://www.classcentral.com/course/how-to-create-a-sales-forecast-in-tableau-65958
Create Digital Marketing Campaign Dashboards in Tableau,Coursera,English,https://www.classcentral.com/course/create-digital-marketing-campaign-dashboards-tabl-66484
Application of Data Analysis in Business with R Programming,Coursera,English,https://www.classcentral.com/course/application-of-data-analysis-in-business-with-r-p-64954
Tableau 10 Essential Training,LinkedIn Learning,English,https://www.classcentral.com/course/linkedin-learning-tableau-10-essential-training-40153
Visualization for Statistical Analysis,Coursera,English,https://www.classcentral.com/course/visualization-for-statistical-analysis-58077
Analysing: Numeric and digital literacies,Coursera,English,https://www.classcentral.com/course/analysing-numeric-digital-literacies-18612
AutoML tools for data science,Coursera,English,https://www.classcentral.com/course/automl-53070
Data Analysis and Presentation Skills: the PwC Approach,Coursera,English,https://www.classcentral.com/course/pwc-analytics-18602
Logistic Regression for Classification using Julia,Coursera,English,https://www.classcentral.com/course/logistic-regression-classification-julia-31685
Performing Real Time Analytics with Stream Analytics,Coursera,English,https://www.classcentral.com/course/performing-real-time-analytics-with-stream-analyt-34049
Crime Zone Heatmaps with Python and Folium,Coursera,English,https://www.classcentral.com/course/crime-zone-heatmaps-python-folium-46382
Deploying a Python Data Analytics web app on Heroku ,Coursera,English,https://www.classcentral.com/course/deploying-a-python-data-analytics-web-app-on-hero-55079
Mastering Data Analysis with Pandas: Learning Path Part 2,Coursera,English,https://www.classcentral.com/course/mastering-data-analysis-with-pandas-learning-path-55812
Time Series Data Visualization And Analysis Techniques ,Coursera,English,https://www.classcentral.com/course/time-series-data-visualization-techniques-55888
Statistical Analysis using Python Numpy,Coursera,English,https://www.classcentral.com/course/statistical-analysis-using-python-numpy-22627
Exploratory Data Analysis with Textual Data in R / Quanteda,Coursera,English,https://www.classcentral.com/course/eda-text-r-quanteda-32117
D3Js Basics,Coursera,English,https://www.classcentral.com/course/d3-basics-22370
Performing Confirmatory Data Analysis in R,Coursera,English,https://www.classcentral.com/course/performing-confirmatory-data-analysis-in-r-22764
Mastering Data Analysis with Pandas: Learning Path Part 3,Coursera,English,https://www.classcentral.com/course/mastering-data-analysis-with-pandas-learning-path-55810
Forecasting US Presidential Elections with Mixed Models,Coursera,English,https://www.classcentral.com/course/forecasting-us-elections-mixed-effects-22167
Analyze Digital Marketing Spend in Tableau,Coursera,English,https://www.classcentral.com/course/analyze-digital-marketing-spend-tableau-41030
Finding bibliography metrics using the Crossref API,Coursera,English,https://www.classcentral.com/course/finding-bibliography-metrics-using-crossref-api-21813
Create a Big Number KPI Dashboard in Tableau Public,Coursera,English,https://www.classcentral.com/course/create-big-number-kpi-dashboard-tableau-public-40327
Creating Models using Smartpls,Coursera,English,https://www.classcentral.com/course/smartpls-advanced-regression-21658
Decision Tree and Random Forest Classification using Julia,Coursera,English,https://www.classcentral.com/course/decision-tree-random-forest-classification-julia-22684
Introduction to Customer Segmentation in Python,Coursera,English,https://www.classcentral.com/course/customer-segmentation-python-22376
Python for Data Visualization: Matplotlib & Seaborn,Coursera,English,https://www.classcentral.com/course/python-for-data-visualization-seaborn-33408
Mastering Data Analysis with Pandas,Coursera,English,https://www.classcentral.com/course/learning-path-data-analysis-with-pandas-55811
Getting Started with Kaggle,Coursera,English,https://www.classcentral.com/course/getting-started-with-kaggle-56640
Compare time series predictions of COVID-19 deaths,Coursera,English,https://www.classcentral.com/course/compare-time-series-predictions-of-covid19-deaths-21853
Essential Causal Inference Techniques for Data Science,Coursera,English,https://www.classcentral.com/course/essential-causal-inference-for-data-science-21421
3D SARS-CoV-19 Protein Visualization With Biopython,Coursera,English,https://www.classcentral.com/course/3d-sars-cov-19-protein-visualization-with-biopyth-21812
Explore stock prices with Spark SQL,Coursera,English,https://www.classcentral.com/course/data-exploration-spark-sql-21101
Overview of Data Visualization,Coursera,English,https://www.classcentral.com/course/overview-data-visualization-46004
Julia for Beginners in Data Science,Coursera,English,https://www.classcentral.com/course/julia-beginners-data-science-21765
Bitcoin Price Prediction using Facebook Prophet,Coursera,English,https://www.classcentral.com/course/bitcoin-price-prediction-using-facebook-prophet-22400
Cleaning and Exploring Big Data using PySpark,Coursera,English,https://www.classcentral.com/course/clean-explore-visualize-big-data-python-spark-21657
Analyzing Product Opportunities with Creately,Coursera,English,https://www.classcentral.com/course/product-strategy-20813
