course_name,platform,language,url
Master Apache Spark - Hands On!,Udemy,English,https://www.classcentral.com/course/udemy-the-ultimate-apache-spark-with-java-course--60307
Tableau Crash Course 2021: Build & Share COVID19 Dashboards,Udemy,English,https://www.classcentral.com/course/udemy-tableau-crash-course-build-and-share-a-covi-69155
Learn BERT - most powerful NLP algorithm by Google,Udemy,English,https://www.classcentral.com/course/udemy-bert-nlp-algorithm-60373
Programming in SAS for beginners,Udemy,English,https://www.classcentral.com/course/udemy-sas-for-beginners-38372
Data Science & Deep Learning for Business™ 20 Case Studies,Udemy,English,https://www.classcentral.com/course/udemy-data-science-deep-learning-for-business-20--68487
Practical SQL Bootcamp for Data Analysts and Data Scientists,Udemy,English,https://www.classcentral.com/course/udemy-practical-sql-bootcamp-for-analysts-67666
The Ultimate Pandas Bootcamp: Advanced Python Data Analysis,Udemy,English,https://www.classcentral.com/course/udemy-the-ultimate-pandas-bootcamp-advanced-pytho-69043
Regression Analysis / Data Analytics in Regression,Udemy,English,https://www.classcentral.com/course/udemy-regression-statistics-86575
Tableau 2019 + Tableau 2018: Tableau CA Certification 2020,Udemy,English,https://www.classcentral.com/course/udemy-tableau-certified-associate-questions-42695
Apache Spark 3 - Spark Programming in Scala for Beginners,Udemy,English,https://www.classcentral.com/course/udemy-apache-spark-programming-in-scala-48518
Apache Spark 3 - Databricks Certified Associate Developer,Udemy,English,https://www.classcentral.com/course/udemy-apache-spark-3-databricks-certified-associa-60469
Architecting Big Data Solutions,Udemy,English,https://www.classcentral.com/course/udemy-architecting-big-data-solutions-86594
Introduction to Data Visualization,Udemy,English,https://www.classcentral.com/course/udemy-introduction-to-data-visualization-67104
"Learn Data Science Deep Learning, Machine Learning NLP & R",Udemy,English,https://www.classcentral.com/course/udemy-learn-data-science-deep-learning-machine-le-88701
SQL for Data Analysis - with SQL Server,Udemy,English,https://www.classcentral.com/course/udemy-sql-basics-crash-course-with-sql-server-69483
Apache NiFi - A Complete Guide | Big DataFlow | HDF & CDF,Udemy,English,https://www.classcentral.com/course/udemy-apache-nifi-the-beginner-guide-42578
Apache Spark 3 - Spark Programming in Python for Beginners,Udemy,English,https://www.classcentral.com/course/udemy-apache-spark-programming-in-python-for-begi-39060
CCA131 Cloudera CDH 5 & 6 Hadoop Administrator Master Course,Udemy,English,https://www.classcentral.com/course/udemy-cca131-demystify-cloudera-distributed-hadoo-87441
Spark 3.0 & Big Data Essentials with Scala | Rock the JVM,Udemy,English,https://www.classcentral.com/course/udemy-spark-essentials-42825
Colors for Data Science A-Z: Data Visualization Color Theory,Udemy,English,https://www.classcentral.com/course/udemy-colordata-67314
Master Course in Tableau Prep - Prepare & Clean Data,Udemy,English,https://www.classcentral.com/course/udemy-tableau_prep-87542
Apache Beam | A Hands-On course to build Big data Pipelines,Udemy,English,https://www.classcentral.com/course/udemy-apache-beam-a-hands-on-course-to-build-big--68766
Tableau 2020 Training for Data Science & Business Analytics,Udemy,English,https://www.classcentral.com/course/udemy-tableau-for-data-science-and-business-analy-69341
Become a Hadoop Developer |Training|Tutorial ,Udemy,English,https://www.classcentral.com/course/udemy-hadoop-tutorial-66569
Complete neural signal processing and analysis: Zero to hero,Udemy,English,https://www.classcentral.com/course/udemy-solved-challenges-ants-87881
Logistic Regression using SAS - Indepth Predictive Modeling,Udemy,English,https://www.classcentral.com/course/udemy-logistic-regression-credit-scoring-modellin-66634
TABLEAU 2018 ADVANCED: Master Tableau in Data Science,Udemy,English,https://www.classcentral.com/course/udemy-tableau-2018-advanced-68035
"ElasticSearch, LogStash, Kibana ELK #1 - Learn ElasticSearch",Udemy,English,https://www.classcentral.com/course/udemy-elasticsearch-logstash-kibana-learn-elastic-67317
Qlik Sense for Data Science and BI,Udemy,English,https://www.classcentral.com/course/udemy-qlik-sense-68744
Tableau 2020 Certified Associate Exam Guide A-Z (w Datasets),Udemy,English,https://www.classcentral.com/course/udemy-tableau-certified-associate-exam-guide-68939
Data Visualization with Python for Beginners,Udemy,English,https://www.classcentral.com/course/udemy-making-graphs-in-python-using-matplotlib-fo-35557
Apache Flink | A Real Time & Hands-On course on Flink,Udemy,English,https://www.classcentral.com/course/udemy-apache-flink-a-real-time-hands-on-course-on-67939
The Simplest Guide to SAS Programming- SAS Base-SAS Advanced,Udemy,English,https://www.classcentral.com/course/udemy-the-simplest-guide-to-sas-programming-for-a-68278
Interactive Data Visualization with Python and Bokeh,Udemy,English,https://www.classcentral.com/course/udemy-python-bokeh-67188
SPSS For Research,Udemy,English,https://www.classcentral.com/course/udemy-spss-for-research-66701
Data Visualization in Excel: All Excel Charts and Graphs,Udemy,English,https://www.classcentral.com/course/udemy-data-visualization-in-excel-for-business-pr-61536
"Complete SQL Bootcamp for Data Science, Analytics, Marketing",Udemy,English,https://www.classcentral.com/course/udemy-sql-for-marketers-data-analytics-data-scien-67056
Tableau Expert: Top Visualization Techniques in Tableau 10,Udemy,English,https://www.classcentral.com/course/udemy-mastering-top-visualization-techniques-in-t-67515
"Complete Course on Data Visualization, Matplotlib and Python",Udemy,English,https://www.classcentral.com/course/udemy-complete-course-on-data-visualization-matpl-67728
The Complete Pandas Bootcamp 2021: Data Science with Python,Udemy,English,https://www.classcentral.com/course/udemy-the-pandas-bootcamp-26538
Data Processing with Logstash (and Filebeat),Udemy,English,https://www.classcentral.com/course/udemy-processing-events-with-logstash-41988
48 Charts in Tableau 2020 -  Basic to Intermediate,Udemy,English,https://www.classcentral.com/course/udemy-tableaupavanlalwani-67415
Beginner Statistics for Data Analytics - Learn the Easy Way!,Udemy,English,https://www.classcentral.com/course/udemy-beginner-stats-68393
Learning Apache Hadoop EcoSystem- Hive,Udemy,English,https://www.classcentral.com/course/udemy-learning-apache-hive-66650
Tableau Desktop for Data Analysis & Data Visualization,Udemy,English,https://www.classcentral.com/course/udemy-up-running-with-tableau-desktop-69325
Tableau 10 Desktop Training,Udemy,English,https://www.classcentral.com/course/udemy-tableau-10-67217
Complete Data Science Training with Python for Data Analysis,Udemy,English,https://www.classcentral.com/course/udemy-complete-data-science-training-with-python--36746
SQL For Data Science With Google Big Query,Udemy,English,https://www.classcentral.com/course/udemy-sql-for-data-science-with-google-big-query-68137
Time Series Analysis in Python 2022,Udemy,English,https://www.classcentral.com/course/udemy-time-series-analysis-in-python-68789
Process Flowcharts & Process Mapping - The Advanced Guide,Udemy,English,https://www.classcentral.com/course/udemy-advanced-process-flowcharts-68090
Tableau Certified Associate in 60 Minutes with Practice Exam,Udemy,English,https://www.classcentral.com/course/udemy-tableau-certified-in-60-minutes-36789
Learn SQL for Data Analysis with Google Big Query,Udemy,English,https://www.classcentral.com/course/udemy-learn-sql-for-data-analysis-with-google-big-68543
Introduction to Time Series Analysis and Forecasting in R,Udemy,English,https://www.classcentral.com/course/udemy-time-series-analysis-and-forecasting-in-r-33662
Careers in Data Science A-Z™,Udemy,English,https://www.classcentral.com/course/udemy-careers-in-data-science-a-ztm-33747
Data Storytelling and Data Visualization [2022],Udemy,English,https://www.classcentral.com/course/udemy-mastering-the-art-of-data-visualization-202-69180
Intro to Data Science: Your Step-by-Step Guide To Starting,Udemy,English,https://www.classcentral.com/course/udemy-intro-to-data-science-33788
TABLEAU 2018: Hands-On Tableau Training For Data Science!,Udemy,English,https://www.classcentral.com/course/udemy-tableau-2018-68034
Hadoop Developer In Real World,Udemy,English,https://www.classcentral.com/course/udemy-hadoopinrealworld-66740
Apache Spark for Java Developers,Udemy,English,https://www.classcentral.com/course/udemy-apache-spark-for-java-developers-68216
Tableau 2019 + Tableau 2018: Tableau DS Certification,Udemy,English,https://www.classcentral.com/course/udemy-tableau-desktop-specialist-certification-38681
Statistics for Data Analysis Using Excel 2016,Udemy,English,https://www.classcentral.com/course/udemy-statistics-using-excel-23374
CCA 175 - Spark and Hadoop Developer Certification - Scala,Udemy,English,https://www.classcentral.com/course/udemy-cca-175-spark-and-hadoop-developer-certific-32977
SAS Programming Complete: Learn SAS and Become a Data Ninja,Udemy,English,https://www.classcentral.com/course/udemy-sascompletetutorial-67172
Elasticsearch 6 and Elastic Stack - In Depth and Hands On!,Udemy,English,https://www.classcentral.com/course/udemy-elasticsearch-6-and-elastic-stack-in-depth--67694
TIBCO Cloud Spotfire Data Visualization and Analytics,Udemy,English,https://www.classcentral.com/course/udemy-tibco-cloud-spotfire-713-certified-analytic-68080
Grafana Beginner to Advanced (3rd Edition),Udemy,English,https://www.classcentral.com/course/udemy-grafana-graphite-and-statsd-visualize-metri-67690
Tableau Specialist Certification Prep,Udemy,English,https://www.classcentral.com/course/udemy-tableau-specialist-certification-prep-38707
Taming Big Data with MapReduce and Hadoop - Hands On!,Udemy,English,https://www.classcentral.com/course/udemy-taming-big-data-with-mapreduce-and-hadoop-66866
Streaming Big Data with Spark Streaming and Scala - Hands On,Udemy,English,https://www.classcentral.com/course/udemy-taming-big-data-with-spark-streaming-hands--23343
The Data Analyst Course: Complete Data Analyst Bootcamp 2022,Udemy,English,https://www.classcentral.com/course/udemy-the-data-analyst-course-complete-data-analy-69645
Introduction to Apache NiFi | Cloudera DataFlow - HDF 2.0,Udemy,English,https://www.classcentral.com/course/udemy-apache-nifi-67279
Complete 2020 Data Science & Machine Learning Bootcamp,Udemy,English,https://www.classcentral.com/course/udemy-python-data-science-machine-learning-bootca-23808
Complete Tableau 2021 Training for Absolute Beginners,Udemy,English,https://www.classcentral.com/course/udemy-tableau-for-beginners-68400
SQL & Database Design A-Z™: Learn MS SQL Server + PostgreSQL,Udemy,English,https://www.classcentral.com/course/udemy-sqldatabases-24753
Big Data and Hadoop for Beginners - with Hands-on!,Udemy,English,https://www.classcentral.com/course/udemy-big-data-and-hadoop-for-beginners-66840
SAS Programming BASE certification course for SAS Beginners,Udemy,English,https://www.classcentral.com/course/udemy-sas-programming-for-beginners-35340
Elasticsearch 7 and the Elastic Stack: In Depth and Hands On,Udemy,English,https://www.classcentral.com/course/udemy-elasticsearch-7-and-elastic-stack-68558
Cluster Analysis and Unsupervised Machine Learning in Python,Udemy,English,https://www.classcentral.com/course/udemy-cluster-analysis-unsupervised-machine-learn-23325
Scala and Spark for Big Data and Machine Learning,Udemy,English,https://www.classcentral.com/course/udemy-scala-and-spark-for-big-data-and-machine-le-23365
Hive to ADVANCE Hive (Real time usage) :Hadoop querying tool,Udemy,English,https://www.classcentral.com/course/udemy-hadoop-querying-tool-hive-to-advance-hivere-67466
QlikSense Visualizations Masterclass,Udemy,English,https://www.classcentral.com/course/udemy-qliksense-visualizations-masterclass-68023
Mastering data visualization in D3.js [2020 UPDATE],Udemy,English,https://www.classcentral.com/course/udemy-masteringd3js-23732
Python for Time Series Data Analysis,Udemy,English,https://www.classcentral.com/course/udemy-python-for-time-series-data-analysis-36065
D3.js Data Visualization Fundamentals - Hands On,Udemy,English,https://www.classcentral.com/course/udemy-d3jsbasics-69135
Certificate in Qlik Sense Analytics Development,Udemy,English,https://www.classcentral.com/course/udemy-is-my-startup-doing-ok-66832
The Complete Tableau Bootcamp for Data Visualization,Udemy,English,https://www.classcentral.com/course/udemy-complete-tableau-bootcamp-dashboards-68583
Complete Machine Learning & Data Science Bootcamp 2021,Udemy,English,https://www.classcentral.com/course/udemy-complete-machine-learning-and-data-science--23344
Master Course in Tableau for Business Intelligence,Udemy,English,https://www.classcentral.com/course/udemy-mastertableau-67171
Master SQL For Data Science,Udemy,English,https://www.classcentral.com/course/udemy-master-sql-for-data-science-67411
SPSS Masterclass: Learn SPSS From Scratch to Advanced,Udemy,English,https://www.classcentral.com/course/udemy-spss-statistics-foundation-course-from-scra-67071
Data Analysis Essentials Using Excel,Udemy,English,https://www.classcentral.com/course/udemy-business-data-analysis-excel-67406
Data Science and Machine Learning Bootcamp with R,Udemy,English,https://www.classcentral.com/course/udemy-data-science-and-machine-learning-bootcamp--23363
Complete Guide to Elasticsearch,Udemy,English,https://www.classcentral.com/course/udemy-elasticsearch-complete-guide-32321
Data Analysis with Pandas and Python,Udemy,English,https://www.classcentral.com/course/udemy-data-analysis-with-pandas-24005
Learn Big Data: The Hadoop Ecosystem Masterclass,Udemy,English,https://www.classcentral.com/course/udemy-learn-big-data-the-hadoop-ecosystem-masterc-67034
Complete Elasticsearch Masterclass with Logstash and Kibana,Udemy,English,https://www.classcentral.com/course/udemy-complete-elasticsearch-masterclass-with-kib-67412
"Tableau for Beginners: Get DA Certified, Grow Your Career",Udemy,English,https://www.classcentral.com/course/udemy-tableau-accelerate-your-career-and-get-cert-66862
Apache Spark with Scala - Hands On with Big Data!,Udemy,English,https://www.classcentral.com/course/udemy-apache-spark-with-scala-hands-on-with-big-d-23322
Tableau 20 Advanced Training: Master Tableau in Data Science,Udemy,English,https://www.classcentral.com/course/udemy-tableau10-advanced-67177
Statistics for Data Science and Business Analysis,Udemy,English,https://www.classcentral.com/course/udemy-statistics-for-data-science-and-business-an-23356
Introduction to Machine Learning for Data Science,Udemy,English,https://www.classcentral.com/course/udemy-machine-learning-for-data-science-23333
The Ultimate Hands-On Hadoop: Tame your Big Data!,Udemy,English,https://www.classcentral.com/course/udemy-the-ultimate-hands-on-hadoop-tame-your-big--61230
"Machine Learning, Data Science and Deep Learning with Python",Udemy,English,https://www.classcentral.com/course/udemy-data-science-and-machine-learning-with-pyth-23373
Microsoft Excel - Advanced Excel Formulas & Functions,Udemy,English,https://www.classcentral.com/course/udemy-excel-for-analysts-26262
The Caltech-JPL Summer School on Big Data Analytics,Coursera,English,https://www.classcentral.com/course/bigdataschool-2482
Explaining Your Data Using Tableau,Coursera,English,https://www.classcentral.com/course/dataviz-explain-6807
Data Science A-Z™: Real-Life Data Science Exercises Included,Udemy,English,https://www.classcentral.com/course/udemy-datascience-23317
Big Data: Mathematical Modelling,FutureLearn,English,https://www.classcentral.com/course/big-data-mathematical-modelling-5422
"Big Data Essentials: HDFS, MapReduce and Spark RDD",Coursera,English,https://www.classcentral.com/course/big-data-essentials-9505
Essential Statistics for Data Analysis using Excel,edX,English,https://www.classcentral.com/course/edx-essential-statistics-for-data-analysis-using-excel-8248
Big Data: Data Visualisation,FutureLearn,English,https://www.classcentral.com/course/big-data-visualisation-5423
Big Data Tools,Coursera,English,https://www.classcentral.com/course/bigdata-tools-11307
Temporal and Hierarchical Data Analysis,Coursera,English,https://www.classcentral.com/course/temporal-and-hierarchical-analysis-11305
Tableau 2020 A-Z: Hands-On Tableau Training for Data Science,Udemy,English,https://www.classcentral.com/course/udemy-tableau10-61173
The Data Science Course 2020: Complete Data Science Bootcamp,Udemy,English,https://www.classcentral.com/course/udemy-the-data-science-course-complete-data-scien-23366
Data to Insight: An Introduction to Data Analysis and Visualisation,FutureLearn,English,https://www.classcentral.com/course/data-to-insight-2129
Data Analysis: Visualization and Dashboard Design,edX,English,https://www.classcentral.com/course/edx-data-analysis-visualization-and-dashboard-design-5388
Additional Tools Used for Data Visualization,Coursera,English,https://www.classcentral.com/course/data-visualization-tools-11303
Data Management in the Cloud,Coursera,English,https://www.classcentral.com/course/data-management-cloud-11301
"Statistics for Researchers: Understanding Mediation, Moderation and Beyond",Coursera,English,https://www.classcentral.com/course/uva-darden-understanding-data-tools-8922
Introduction to Data Exploration and Visualization,Coursera,English,https://www.classcentral.com/course/intro-to-data-exploration-11220
Introduction to R for Data Science,FutureLearn,English,https://www.classcentral.com/course/data-science-8118
Programming with Python for Data Science,edX,English,https://www.classcentral.com/course/edx-programming-with-python-for-data-science-6471
Statistical Predictive Modelling and Applications,edX,English,https://www.classcentral.com/course/edx-statistical-predictive-modelling-and-applications-14422
Processing Big Data with Hadoop in Azure HDInsight,edX,English,https://www.classcentral.com/course/edx-processing-big-data-with-hadoop-in-azure-hdinsight-3917
Data Science 2021 : Complete Data Science & Machine Learning,Udemy,English,https://www.classcentral.com/course/udemy-complete-data-science-and-machine-learning--34269
Social Media Analytics: Using Data to Understand Public Conversations,FutureLearn,English,https://www.classcentral.com/course/social-media-analytics-6135
Delivering Research Data Management Services,FutureLearn,English,https://www.classcentral.com/course/delivering-research-data-management-services-13856
"Communicating Results: Visualization, Ethics, Reproducibility",Coursera,English,https://www.classcentral.com/course/datasci3-4247
How to Win a Data Science Competition: Learn from Top Kagglers,Coursera,English,https://www.classcentral.com/course/competitive-data-science-9605
Data Science Essentials,edX,English,https://www.classcentral.com/course/edx-data-science-essentials-6512
Advanced Machine Learning,FutureLearn,English,https://www.classcentral.com/course/advanced-machine-learning-10341
FA19: Statistical Modeling and Regression Analysis,edX,English,https://www.classcentral.com/course/edx-fa19-statistical-modeling-and-regression-analysis-8996
"Business Statistics, Data Analysis, and Decision Making: Part 2",Coursera,English,https://www.classcentral.com/course/business-statistics-2-5245
Inteligencia artificial aplicada,edX,Spanish,https://www.classcentral.com/course/ibm-inteligencia-artificial-aplicada-20672
Successfully Evaluating Predictive Modelling,edX,English,https://www.classcentral.com/course/edx-successfully-evaluating-predictive-modelling-14421
Big Data Analytics in Healthcare,edX,English,https://www.classcentral.com/course/edx-big-data-analytics-in-healthcare-9045
Ciencia de datos con Python,edX,Spanish,https://www.classcentral.com/course/ibm-ciencia-de-datos-con-python-21953
Big Data: Statistical Inference and Machine Learning,FutureLearn,English,https://www.classcentral.com/course/big-data-machine-learning-5421
Foundations of Data Analysis - Part 2: Inferential Statistics,edX,English,https://www.classcentral.com/course/edx-foundations-of-data-analysis-part-2-inferential-statistics-4804
IBM: Fundamentos de ciencia de datos,edX,Spanish,https://www.classcentral.com/course/ibm-fundamentos-de-ciencia-de-datos-20681
IBM: Ciencia de datos,edX,Spanish,https://www.classcentral.com/course/ibm-ciencia-de-datos-21950
Data Engineering on Google Cloud Platform em Português Brasileiro,Coursera,Portuguese,https://www.classcentral.com/course/gcp-data-machine-learning-br-18791
数据科学 | Data Science,edX,Chinese,https://www.classcentral.com/course/tsinghuax-data-science-18452
Data Engineering on Google Cloud Platform en Français,Coursera,French,https://www.classcentral.com/course/gcp-data-machine-learning-fr-18847
Data Engineering on Google Cloud Platform 日本語版,Coursera,Japanese,https://www.classcentral.com/course/gcp-data-machine-learning-jp-18676
Data Engineering on Google Cloud Platform en Español,Coursera,Spanish,https://www.classcentral.com/course/gcp-data-machine-learning-es-18902
Ciencia de Datos Aplicada,Coursera,Spanish,https://www.classcentral.com/course/ciencia-de-datos-aplicada-22439
Introducción a la Especialización en Ciencia de Datos,Coursera,Spanish,https://www.classcentral.com/course/introduccion-a-la-especializacion-en-ciencia-de-d-22280
Bases de Inteligencia Artificial para Todos,Coursera,Spanish,https://www.classcentral.com/course/bases-de-inteligencia-artificial-para-todos-22281
"Data Engineer, Big Data and ML on Google Cloud auf Deutsch",Coursera,German,https://www.classcentral.com/course/gcp-data-machine-learning-de-21670
"Data Engineering, Big Data and ML on Google Cloud 日本語版",Coursera,Japanese,https://www.classcentral.com/course/gcp-data-machine-learning-jp-21681
From Data to Insights with Google Cloud Platform 日本語版,Coursera,Japanese,https://www.classcentral.com/course/from-data-to-insights-google-cloud-platform-jp-18826
"Data Engineer, Big Data and ML on Google Cloud en Français",Coursera,French,https://www.classcentral.com/course/gcp-data-machine-learning-fr-21696
"Data Engineer, Big Data and ML on Google Cloud auf Deutsch",Coursera,German,https://www.classcentral.com/course/gcp-data-machine-learning-de-18571
Minería de datos aplicada al marketing,edX,Spanish,https://www.classcentral.com/course/anahuacx-mineria-de-datos-aplicada-al-marketing-48037
Fundamentos de Ciencia de Datos con R,edX,Spanish,https://www.classcentral.com/course/anahuacx-fundamentos-de-ciencia-de-datos-con-r-20678
Ciencia de Datos de IBM,Coursera,Spanish,https://www.classcentral.com/course/certificado-profesional-de-ciencia-de-datos-de-ib-22276
Fundamentos del Análisis y Visualización de Datos,Coursera,Spanish,https://www.classcentral.com/course/fundamentos-del-analisis-y-visualizacion-de-datos-32634
"Data Engineer, Big Data and ML on Google Cloud em Português",Coursera,Portuguese,https://www.classcentral.com/course/gcp-data-machine-learning-br-21698
"Data Engineering, Big Data and ML on Google Cloud en Español",Coursera,Spanish,https://www.classcentral.com/course/gcp-data-machine-learning-es-21699
Python aplicado a la Ciencia de Datos,edX,Spanish,https://www.classcentral.com/course/anahuacx-python-aplicado-a-la-ciencia-de-datos-21968
Анализ данных,Coursera,Russian,https://www.classcentral.com/course/analiz-dannykh-18620
"Big Data, Cloud Computing, & CDN Emerging Technologies",Coursera,English,https://www.classcentral.com/course/coursera-big-data-cloud-computing-cdn-emerging-technologies-3931
Introduction to Data Science,edX,English,https://www.classcentral.com/course/edx-introduction-to-data-science-6405
Preparing for Google Cloud Certification: Cloud Data Engineer Professional Certificate 日本語版,Coursera,Japanese,https://www.classcentral.com/course/gcp-data-engineering-jp-21946
Big Data: Measuring And Predicting Human Behaviour,FutureLearn,English,https://www.classcentral.com/course/big-data-3295
Data Mining Capstone,Coursera,English,https://www.classcentral.com/course/dataminingcapstone-4154
Big Data: capstone project,Coursera,Spanish,https://www.classcentral.com/course/big-data-proyecto-12283
Maestría en Inteligencia Analítica de Datos,Coursera,Spanish,https://www.classcentral.com/course/uniandes-master-data-analytics-20886
High Performance Scientific Computing,Coursera,English,https://www.classcentral.com/course/scicomp-764
Essential quantitative business skills,edX,Spanish,https://www.classcentral.com/course/tecdemonterreyx-essential-quantitative-business-s-37713
"Habilidades cuantitativas esenciales en finanzas, negocios y ciencia de datos",edX,Spanish,https://www.classcentral.com/course/tecdemonterreyx-habilidades-cuantitativas-esencia-20677
Análisis de Datos para la toma de decisiones,Coursera,Spanish,https://www.classcentral.com/course/analisis-datos-18694
Créer un diagramme d’affinité avec Creately,Coursera,French,https://www.classcentral.com/course/creer-diagramme-affinite-creately-65964
Utiliser LucidChart pour petites entreprises,Coursera,French,https://www.classcentral.com/course/utiliser-lucidchart-pour-petites-entreprises-65787
Big Data – Introducción al uso práctico de datos masivos ,Coursera,Spanish,https://www.classcentral.com/course/big-data-introduccion-18699
Introducción a Scala en Big data con Databricks,Coursera,Spanish,https://www.classcentral.com/course/scala-big-data-22794
DataViz - Grammaire des Graphiques avec Python,Coursera,French,https://www.classcentral.com/course/dataviz-grammaire-des-graphiques-avec-python-33415
Trabajando con Dask,Coursera,Spanish,https://www.classcentral.com/course/trabajando-dask-53013
